{
  "$schema": "../schema/seido-common.schema.json",
  "id": "koyou-hoken-ryoritsu",
  "name": "雇用保険料率（令和8年度・令和7年度）",
  "fiscalYear": 2026,
  "asOf": "2026-07-17",
  "sources": [
    {
      "id": "mhlw-koyou-r08",
      "title": "令和８（2026）年度雇用保険料率のご案内",
      "publisher": "厚生労働省",
      "url": "https://www.mhlw.go.jp/content/001692566.pdf",
      "landingUrl": "https://www.mhlw.go.jp/stf/seisakunitsuite/bunya/0000108634.html",
      "checkedAt": "2026-07-17",
      "tier": "ministry",
      "contentType": "pdf",
      "note": "★backlog §8『雇用保険料率（令和8年度）』の解禁データ★ ★1枚のPDFに令和8年度と令和7年度の両方が載っている★ 表の各業種の行が2段構成で、上段が令和8年度、下段（『（令和７年度）』と明記）が令和7年度の料率。8a（保育料推計）は令和7年分の所得に対する社会保険料控除を推計するため下段（令和7年度）を使う。"
    },
    {
      "id": "mhlw-koyou-landing",
      "title": "雇用保険料率について",
      "publisher": "厚生労働省",
      "url": "https://www.mhlw.go.jp/stf/seisakunitsuite/bunya/0000108634.html",
      "checkedAt": "2026-07-17",
      "tier": "ministry",
      "contentType": "html",
      "note": "年度ごとの『雇用保険料率のご案内』PDFの掲載元ページ。PDFのURLは年度ごとに変わるため、改定時はこのページから辿る。"
    }
  ],
  "amendments": [
    {
      "summary": "令和8年度の雇用保険料率は令和8年4月1日から令和9年3月31日まで適用。失業等給付・育児休業給付の保険料率が労使ともに 5.5/1,000 → 5/1,000 に引下げ（一般の事業）。雇用保険二事業の保険料率（事業主のみ）は3.5/1,000で据置き。",
      "status": "in-force",
      "effectiveFrom": "2026-04-01",
      "sourceId": "mhlw-koyou-r08",
      "impact": "手取り計算の労働者負担が0.55%→0.5%に下がる。★雇用保険料率は『年度』（4月〜翌年3月）単位で、協会けんぽの『3月分〜翌年2月分』とは適用期間の区切りが異なる★ 令和9年度分は例年2月頃に公表される（data.nextCheckDue で監視）。"
    }
  ],
  "disclaimer": "本データは厚生労働省が公表する雇用保険料率に基づく概算計算用です。実際に控除される雇用保険料は賃金総額（通勤手当・残業代・賞与を含む）に料率を乗じて計算され、事業の種類によって料率が異なります。雇用保険の被保険者に該当しない働き方（週所定労働時間が短い場合等）では雇用保険料は発生しません。正確な金額は給与明細または勤務先にご確認ください。",
  "data": {
    "overview": {
      "description": "雇用保険料率。労働者負担分は『失業等給付・育児休業給付の保険料率』のみで、『雇用保険二事業の保険料率』は事業主のみが負担する。手取り計算に使うのは労働者負担分（worker）だけ。",
      "note": "★健康保険・厚生年金との決定的な違い: 標準報酬月額を使わない★ 雇用保険料は標準報酬月額ではなく、実際に支払われた賃金総額（賞与を含む）に直接料率を乗じて計算する。したがって等級表による頭打ち（厚生年金の650,000円上限等）が存在せず、高収入でも料率がそのままかかる。kyoukaikenpo-hokenryo.json の等級表を雇用保険に適用してはならない。",
      "scope": "★労使折半ではない★ 失業等給付・育児休業給付の保険料率は労使が同率を負担するが（一般の事業で各5/1,000）、事業主はさらに雇用保険二事業の保険料率（3.5/1,000）を負担するため、合計では事業主の方が負担が大きい（8.5/1,000 対 5/1,000）。"
    },
    "ratesFY2026": {
      "description": "令和8年度（令和8年4月1日〜令和9年3月31日）の雇用保険料率。",
      "label": "令和8年度雇用保険料率",
      "sourceId": "mhlw-koyou-r08",
      "checkedAt": "2026-07-17",
      "verify": {
        "expect": [
          "令和８（2026）年度雇用保険料率のご案内",
          "令和８（202６）年４月１日から令和９（202７）年３月31日までの雇用保険料率は以下",
          "失業等給付等の保険料率は、労働者負担・事業主負担ともに5/1,000に変更になります",
          "雇用保険二事業の保険料率（事業主のみ負担）は、引き続き3.5/1,000です"
        ]
      },
      "amendmentNote": "令和9年度分は例年2月頃公表。",
      "rows": [
        {
          "businessType": "一般の事業",
          "worker": 0.005,
          "workerLabel": "5/1,000",
          "employer": 0.0085,
          "employerLabel": "8.5/1,000",
          "total": 0.0135,
          "totalLabel": "13.5/1,000",
          "sourceId": "mhlw-koyou-r08",
          "checkedAt": "2026-07-17",
          "note": "★手取り計算の既定はこの行★ 事業主負担8.5/1,000の内訳は、失業等給付・育児休業給付5/1,000 ＋ 雇用保険二事業3.5/1,000。※園芸サービス、牛馬の育成、酪農、養鶏、養豚、内水面養殖および特定の船員を雇用する事業についても一般の事業の率が適用される（原典の注記）。"
        },
        {
          "businessType": "農林水産・清酒製造の事業",
          "worker": 0.006,
          "workerLabel": "6/1,000",
          "employer": 0.0095,
          "employerLabel": "9.5/1,000",
          "total": 0.0155,
          "totalLabel": "15.5/1,000",
          "sourceId": "mhlw-koyou-r08",
          "checkedAt": "2026-07-17",
          "note": "★原典の注記により、園芸サービス・牛馬の育成・酪農・養鶏・養豚・内水面養殖および特定の船員を雇用する事業は、この行ではなく『一般の事業』の率が適用される★"
        },
        {
          "businessType": "建設の事業",
          "worker": 0.006,
          "workerLabel": "6/1,000",
          "employer": 0.0105,
          "employerLabel": "10.5/1,000",
          "total": 0.0165,
          "totalLabel": "16.5/1,000",
          "sourceId": "mhlw-koyou-r08",
          "checkedAt": "2026-07-17",
          "note": "雇用保険二事業の保険料率が4.5/1,000（他業種は3.5/1,000）のため事業主負担が最も重い。"
        }
      ]
    },
    "ratesFY2025": {
      "description": "令和7年度（令和7年4月1日〜令和8年3月31日）の雇用保険料率。★令和8年度のご案内PDFの表の下段（『（令和７年度）』と明記された行）が一次情報★",
      "label": "令和7年度雇用保険料率",
      "sourceId": "mhlw-koyou-r08",
      "checkedAt": "2026-07-17",
      "verify": {
        "expect": [
          "（令和７年度）",
          "5.5/1,000",
          "14.5/1,000",
          "（枠内の下段は令和７年４月～令和８年３月の雇用保険料率）"
        ]
      },
      "amendmentNote": "過年度の確定値。令和8年4月1日から令和8年度料率（ratesFY2026）に切り替わっている。",
      "note": "★8a（保育料推計）が使うのはこちら★ 令和8年度の保育料は令和8年度課税＝令和7年分（暦年2025年）の所得で判定し、その所得から差し引かれる社会保険料控除は暦年2025年に実際に納めた保険料である。★年度と暦年のずれ★ 暦年2025年のうち1月〜3月は令和6年度料率（労働者負担6/1,000）、4月〜12月（9か月）は令和7年度料率（5.5/1,000）が適用されている。令和6年度料率は本データに未収録のため、8a推計は12か月すべてを令和7年度料率とみなす（誤差は年収500万円で数百円程度）。",
      "rows": [
        {
          "businessType": "一般の事業",
          "worker": 0.0055,
          "workerLabel": "5.5/1,000",
          "employer": 0.009,
          "employerLabel": "9/1,000",
          "total": 0.0145,
          "totalLabel": "14.5/1,000",
          "sourceId": "mhlw-koyou-r08",
          "checkedAt": "2026-07-17"
        },
        {
          "businessType": "農林水産・清酒製造の事業",
          "worker": 0.0065,
          "workerLabel": "6.5/1,000",
          "employer": 0.01,
          "employerLabel": "10/1,000",
          "total": 0.0165,
          "totalLabel": "16.5/1,000",
          "sourceId": "mhlw-koyou-r08",
          "checkedAt": "2026-07-17"
        },
        {
          "businessType": "建設の事業",
          "worker": 0.0065,
          "workerLabel": "6.5/1,000",
          "employer": 0.011,
          "employerLabel": "11/1,000",
          "total": 0.0175,
          "totalLabel": "17.5/1,000",
          "sourceId": "mhlw-koyou-r08",
          "checkedAt": "2026-07-17"
        }
      ]
    },
    "nextCheckDue": "2027-02-01",
    "nextCheckReason": "令和9年度の雇用保険料率は例年2月頃に公表され、令和9年4月1日から適用される。掲載元ページ（mhlw-koyou-landing）から新年度の『雇用保険料率のご案内』PDFを辿ること（PDFのURLは年度ごとに変わる）。"
  }
}
